id,project,status,created_at,updated_at,application_round,wallet_address,last_updated,project_id,title,description,website,github_user,project_github,project_twitter,previous_funding,team_size,live_on_other_chains,project_value,improvements_to_existing_project
0x06e848f768e6e972fdc073e58678bf371083fd9ea45fcebd4d4925102513f297-0xebdb4156203c8b35b7a7c6f320786b98e5ac67c3,0x06e848f768e6e972fdc073e58678bf371083fd9ea45fcebd4d4925102513f297,PENDING,2022-11-22 12:59:29,2022-11-22 12:59:29,0xebdb4156203c8b35b7a7c6f320786b98e5ac67c3,0xd42d631ae4c242db45671cf7cbfa2289d8db56fe,0,62,InterSwap,"InterSwap is the first fully composable native asset cross-chain AMM with unified liquidity built on top of the LayerZero network.

InterSwap offers the smoothest user experience for cross-chain swaps - seamless native swaps across chains within 3 clicks, 2 minutes and 1 transaction in the trustless way. 


Additional use case: a non-custodial automated cross-chain portfolio manager.
",https://interswap.io/,https://github.com/KonstantinRmz,https://github.com/Interswap-labs,@InterSwap_io,"We received a grant from Polygon, Moonbeam. Some seed round funding from VCs and angels.",10,"Currently we are deployed on testnets of 8 networks: Ethereum, BSC, Polygon, Avalanche, Optimism, Fantom, Moonbeam, Arbitrum). We have a plans to deploy on several more chains in near future.","We are addressing liquidity fragmentation, insecure bridging solutions and exposure to CEXes during cross-chain transaction. After Ethereum birth we’ve witnessed the rise of many L1s and L2s, most of them aiming to resolve scalability issues and provide enhanced  smart contracts capabilities. Consequences of increasing the number of networks led the whole blockchain industry to liquidity fragmentation across different networks.   According to the latest report, 69% of all crypto theft taken place in 2022 came from cross-chain bridge hacks. The report from Chainalysis, the firm that deals with blockchain analytics stated that 14 token bridge hacks have occurred in 2022 so far and that led to theft of $2bil+.We are building most capital efficient cross-chain AMM with unified liquidity; and non custodial automated cross-chain portfolio manager built on top of LayerZero network. Seamless onboarding of users from all supported chains for Moonbeam chain, protocols and dApps built on it.  InterSwap has capabilities to connect several chains through single liquidity pool, making protocol most capital efficient solution on the market.  Here is detailed proposition and description of solution.",
0x089e0079dacd3c682f9e9a9ee90b7354cf706c0c1f737afbc8f389e166c5f06a-0xebdb4156203c8b35b7a7c6f320786b98e5ac67c3,0x089e0079dacd3c682f9e9a9ee90b7354cf706c0c1f737afbc8f389e166c5f06a,PENDING,2022-11-27 14:40:37,2022-11-27 14:40:37,0xebdb4156203c8b35b7a7c6f320786b98e5ac67c3,0xbcedb3e27f2650f4698e1cc6a02bbd2cef123b4b,0,80,FantomNames.org - Web3 Social Usernames,"We (Punk Domains) are building a unique way for the Fantom community to interact with each other on the upcoming Web3 Social.

We are launching a Web3 Social username service called FantomNames.org where anybody could mint their very own web3 domain username with a .fantom extension.

The .fantom extension represents the Fantom community. Once the username is minted it belongs to the user forever (no renewables).

### Strengthening bonds within the Fantom community

Many people are already using .eth names as usernames on Twitter and other social media.

Imagine the same happening for the Fantom community. Having your own domain extension is good for spreading awareness and it also strengthens bonds between members of the community.

### More than just a domain

Web3 names are a digital identity. Fantom members can use domains as usernames when they log into web3 apps. They can also attach additional data to a domain, like a website URL, or a Twitter handle, or email address. Or they can use domains to easily send tokens and NFTs to each other.

The Fantom Names service is built on top of the Punk Domains protocol that is the go-to protocol for many big projects like KlimaDAO, Smol Brains, Layer2DAO and more.

### Many possible integrations

Any dApp or web3 frontend can easily integrate with .fantom domain extensions.

The protocol is completely permissionless and the code is open-sourced on our Github: https://github.com/punk-domains

### Minting fees => Public Goods

We are firm believers in public goods funding.

That is why 50% of the domain minting proceeds will go into funding public goods projects on Fantom.

### The future & conclusion

Web3 Social is arriving in a big way. There are many projects building different parts (lego blocks) of the upcoming Web3 Social.

Usernames (aka “domains”) are one of these building blocks. The whole idea is based on the fact that every user owns their online identity and the content they produce (posts, comments, images, etc.)

Web3 names are the integral part of Web3 Social. They mainly serve as usernames, but can also hold additional (optional) data such as homepage URL, image data, email address, etc.

Let’s bring the Fantom community into the Web3 Social space together!

- Website: https://fantomnames.org/
- Twitter: https://twitter.com/PunkDomains
- GitHub: https://github.com/punk-domains",https://fantomnames.org,tempe-techie,punk-domains,PunkDomains,Gitcoin,2,Yes,"It's a web3 domain protocol that can issue multiple domain extensions. Each project on Fantom can have their own domain extension through our protocol. This helps with marketing efforts (spreading awareness about the project) and also brings revenue to the project treasury. There are many DAOs already using our protocol, such as KlimaDAO, Smol Brains, L2DAO, etc.","No, we have our own unique codebase."
0x09019d0ef8ae691debea7dc4d96f0f76edb2b97107a148e841c151a9966fbed5-0xebdb4156203c8b35b7a7c6f320786b98e5ac67c3,0x09019d0ef8ae691debea7dc4d96f0f76edb2b97107a148e841c151a9966fbed5,PENDING,2022-12-02 18:49:32,2022-12-02 18:49:32,0xebdb4156203c8b35b7a7c6f320786b98e5ac67c3,0xc2e704499e5607be3a6364f96129636b96f5ec48,0,250:0x8e1bD5Da87C14dd8e08F7ecc2aBf9D1d558ea174:122,Just Brew It DAO,"A DAO where the NFT holders decide on the creation of a brewery from where it will be built, to the types of beers to brew, to the labels for the bottles. NFT holders will receive benefits ranging from discounts, swag, receiving free beer quarterly, all the way up to revenue sharing. ",https://JustBrewIt.DAO,,JustBrewItDAO,JustBrewItDAO,No,1,No,Allowing the entire globe to decide on all of the details of creating a brewery from the ground up. ,No
0x0bc6b0feab6bb662019b824fc223d5cfe217bbe1605295fc022be2e58360683c-0xebdb4156203c8b35b7a7c6f320786b98e5ac67c3,0x0bc6b0feab6bb662019b824fc223d5cfe217bbe1605295fc022be2e58360683c,PENDING,2022-11-28 09:19:19,2022-11-28 09:19:19,0xebdb4156203c8b35b7a7c6f320786b98e5ac67c3,0x4e260bb2b25ec6f3a59b478fcde5ed5b8d783b02,0,83,Web3 Payments for Fantom - DePay,"DePay pioneers Web3 Payments with the power of DeFi.

It allows to accept any token with on-the-fly conversion (through decentralized exchanges).

DePay provides a full-stack infrastructure for Web3 Payments consisting of the payment protocol, payment router smart contracts, open source libraries, apis, and payment gateways.

DePay is currently the only P2P payment app on Shopify (https://apps.shopify.com/depay) and a WooCommerce payment partner (https://woocommerce.com/products/depay-payments/).

This grant is to support adding Fantom to DePay, ultimately allowing anyone to receive payments directly into their wallets, settled on the Fantom network.",https://depay.com,10xsebastian,depayfi,depay,Founder funded.,5,Yes,Web3 Payments. On-the-fly payment conversion through DeFi. P2P payment gateways for E-Commerce (Shopify + WooCommerce). Open-Source libraries.,
0x0c7fc7c4591c4bb4fc181a7369309a47bd9f9d66f4215005b2fa1e9dd34949ba-0xebdb4156203c8b35b7a7c6f320786b98e5ac67c3,0x0c7fc7c4591c4bb4fc181a7369309a47bd9f9d66f4215005b2fa1e9dd34949ba,PENDING,2022-11-21 20:01:45,2022-11-21 20:01:45,0xebdb4156203c8b35b7a7c6f320786b98e5ac67c3,0xc1501c73cf23067e2a16faceb5be4796cd8f2111,0,59,DOG's Forensics as a Service (Faas),"Dog, Fantom's most persistent annoyances, is willing to continue investigating disingenuous and criminal activity on the fantom network; in accordance with The fantom foundation's Gitcoin program.",https://ftmscan.com,,,,no,1,no,"Investigation and forensics, much needed due to the heavy deception on fantom.",No.
0x1207e7650bc9cd89d2ae967b0b63f591162bbe5fc2f64dea3a749dfda5b67449-0xebdb4156203c8b35b7a7c6f320786b98e5ac67c3,0x1207e7650bc9cd89d2ae967b0b63f591162bbe5fc2f64dea3a749dfda5b67449,PENDING,2022-11-16 17:01:53,2022-11-16 17:01:53,0xebdb4156203c8b35b7a7c6f320786b98e5ac67c3,0x48294a067d1bc5a58bcbab4b3be329d078d9e1af,0,45,Pin Save: decentralized Pinterest,"Pin Save is a decentralized image sharing and content aggregation platform where users can not only control the content, but also the platform itself.

The combination of decentralized storage, smart contracts and creator ownership of intellectual property creates new dynamics between content creators and forms new more meaningful communities.

Pin Save 4 key features:
The decentralized Feed to reinforce discovery of content and feedback.
Decentralized Identity (ERC-725) to provide anonymity and data protection.
Upgradeable, resilient, and more open decentralized storage.
Smart Contracts to securely serve web experiences directly to users.

Pin Save assists in lowering the threshold for users to enter the web3 space, provides incentives to share content and effectively improves the adoption of the decentralized technology.",https://evm.pinsave.app,pfed-prog,dspytdao,PinSav3,Filecoin Grant and Hackathons,3,yes on testnet,"One of our developers has completed developers program with SkyNet decentralized storage provider. Currently we are in the grant process with Filecoin. As a result, we believe we possess a competitive advantage in providing our user the best tailored decentralized storage experience.  The combination of decentralized storage, smart contracts and creator ownership of intellectual property creates new dynamics between content creators and forms new more meaningful communities.  Pin Save assists in lowering the threshold for users to enter the web3 space, provides incentives to share content and effectively improves the adoption of the decentralized technology.",
0x1d02cf91e0538941b643db2b34a1b9e72fbf129a021ecc0f569980b1a6f45bc3-0xebdb4156203c8b35b7a7c6f320786b98e5ac67c3,0x1d02cf91e0538941b643db2b34a1b9e72fbf129a021ecc0f569980b1a6f45bc3,PENDING,2022-11-17 15:46:22,2022-11-17 15:46:22,0xebdb4156203c8b35b7a7c6f320786b98e5ac67c3,0x4d9339dd97db55e3b9bcbe65de39ff9c04d1c2cd,0,49,Giveth,"Giveth is using blockchain to reward and empower those who give to projects, to society, and to the world! 
Our community is focused on Building the Future of Giving using blockchain technology. Our intention is to support and reward the funding of public goods by creating open, transparent and free access to the revolutionary funding opportunities available within the Ethereum ecosystem.",https://giveth.io,,,@Givethio,NO,54,"yes, Ethereum and Gnosis",We are thrilled to partner up with Fantom to offer the 1st donation platform in the ecosystem by adding it to our chain!,
0x1e9e8d47b2f14f961f5b27b76a06753d987cc36ea0e85405bace67aa4fa3f89d-0xebdb4156203c8b35b7a7c6f320786b98e5ac67c3,0x1e9e8d47b2f14f961f5b27b76a06753d987cc36ea0e85405bace67aa4fa3f89d,PENDING,2022-11-22 19:34:49,2022-11-22 19:34:49,0xebdb4156203c8b35b7a7c6f320786b98e5ac67c3,0xb614b1464c561eb2fd0d7d3475feb52b5a34dec0,0,16,Pepemon: Degen Battleground,"Pepemon it's a DAO owned by the players building open gaming goods in web3.

Degen Battleground is the first Pepemon game. A play and earn trading card game, it's powered by DeFi, using NFTs as in-game assets, and governed decentralized by the players. An easy to learn, difficult to master Trading Card Game where users will duel each other on blockchain in their journey to become the very best.


Pepemon started in 2020 as one of the new decentralized economies with a 99.86% airdrop of the tokens to the community members that helped spreading the word on our mission: build a blockchain game that it's owned by the players.


Since inception we launched different dapps in our economy including:

- Our staking platform with ~80% of PPBLZ token in staking or ~$3mil TVL.

- A NFT Store that sold more than $1mil of digital cards.

- A way for Pepetrainers to stake and evolve their existing NFTs in NFT Staking Events.

- A Unity game app pending launching on Android, iOS and web.",https://pepemon.world/,,,pepemonfinance,Gitcoin grants,7,Yes,A trading card game on chain utilizing a DeFi economy to pay players with NFT cards,"Everything is developed from scratch, open source with other open gaming goods."
0x268db24b83a82d31b0856f31c87f9c9b6248ed4ea313ca97281efb8797de0e39-0xebdb4156203c8b35b7a7c6f320786b98e5ac67c3,0x268db24b83a82d31b0856f31c87f9c9b6248ed4ea313ca97281efb8797de0e39,PENDING,2022-11-30 11:37:55,2022-11-30 11:37:55,0xebdb4156203c8b35b7a7c6f320786b98e5ac67c3,0xd05aa43ea6bed1d138111fe58802fe88dee93bc6,0,250:0x8e1bD5Da87C14dd8e08F7ecc2aBf9D1d558ea174:93,Eyepto,"What if all crypto transactions could be done with QR codes only?

What if you don't need to be using a DApp to use crypto?

What if you could turn any Instagram, TikTok.. content into an NFT?

What if you could trade your crypto assets on your favorite messaging apps with real people you know?

What if physical stores could reward their users with NFTs and other crypto assets by simply having the Eyepto mobile app?

This is what Eyepto is, and many more things are possible.

Eyepto is meant to unleash the power of crypto outside of DApps and bring it into the hands of everyone.",https://eyepto.com,https://github.com/devzl,https://github.com/eyepto,0xeyepto,No,2,Yes,Create an easy to access way to crypto and allow more innovation about what can be in the Fantom ecosystem.,
0x26c147b6e04f82c9cf7e451517fc56a42e15f0a65c21074223b5b1e8c44fa11b-0xebdb4156203c8b35b7a7c6f320786b98e5ac67c3,0x26c147b6e04f82c9cf7e451517fc56a42e15f0a65c21074223b5b1e8c44fa11b,PENDING,2022-11-14 19:38:56,2022-11-14 19:38:56,0xebdb4156203c8b35b7a7c6f320786b98e5ac67c3,0x080749e06a9fee7af0e9c922bd6901f9edf86033,0,13,The Sterling project,"Im building stuff, I think. Im crowdsourcing what im gonna build.2",https://discord.gg/pPqRtzDG,,,@not__sterling,No,250,No,A little bit if everything. Your imagination is the limit. ,
0x2fffdbabe689b782496d15ee8c7c0310329ed63519041c70a8039fce74cd932b-0xebdb4156203c8b35b7a7c6f320786b98e5ac67c3,0x2fffdbabe689b782496d15ee8c7c0310329ed63519041c70a8039fce74cd932b,PENDING,2022-12-01 22:56:09,2022-12-01 22:56:09,0xebdb4156203c8b35b7a7c6f320786b98e5ac67c3,0x677d6ec74fa352d4ef9b1886f6155384acd70d90,0,250:0x8e1bD5Da87C14dd8e08F7ecc2aBf9D1d558ea174:108,Atlantica Market,"Atlantica is designed for everyone, from all networks and will offer a wide range of NFTs including but not limited to artworks, videos and music.

We’re striving to offer the best utility available and have designed our platform as an interactive, user-friendly space that inspires creativity and community engagement. Our beta will launch as a leading NFT marketplace on the Fantom Network, but the future of Atlantica lies in a multichain platform that can integrate crosschain transactions. Hector Network is committed to pioneering the future in both the Defi and NFT arena.",https://atlantica.market,,,https://twitter.com/AtlanticaMarket,"Yes, we received also the last Fantom Incentive Program for a few weeks.",Hector Network overall around 45,No,"As an innovative and user-friendly NFT marketplace, Atlantica brings many advantages. The NFT sector will continue to grow alongside art, as the possibilities for NFTs and their utilities are limitless. Atlantica, with its secure environment, will support the Fantom Network as such and bring many users onto the chain. Our partnership with Borussia Dortmund and the associated planned marketing measures for Atlantica will support this.",
0x30b826002362b50fbcc7ee9ccd0515e4ab91c14141d3c037df69398c04a026ed-0xebdb4156203c8b35b7a7c6f320786b98e5ac67c3,0x30b826002362b50fbcc7ee9ccd0515e4ab91c14141d3c037df69398c04a026ed,PENDING,2022-11-18 19:46:02,2022-11-18 19:46:02,0xebdb4156203c8b35b7a7c6f320786b98e5ac67c3,0x08a3c2a819e3de7aca384c798269b3ce1cd0e437,0,54,DefiLlama,Open and transparent DeFi TVL and analytics. Fully Open Source.,https://defillama.com/,0xngmi,DefiLlama,DefiLlama,"Previously received funding from Gitcoin Grants, direct donations and self-funding. No investment received.",13,"Yes, DefiLlama tracks almost all chains and LlamaPay is live on most EVM chains.","We track DeFi metrics for fantom projects, such as TVL, Volume, Fees/Revenue and APYs of pools, improving discover-ability for projects on fantom. LlamaPay is also live on fantom and it's used by multiple native fantom teams such as SpookySwap to distribute salaries to their team members.",
0x3431b7e39ae4004e7bd741879b334984e869ca6ada7954845efb74c16f543e43-0xebdb4156203c8b35b7a7c6f320786b98e5ac67c3,0x3431b7e39ae4004e7bd741879b334984e869ca6ada7954845efb74c16f543e43,PENDING,2022-11-29 10:30:51,2022-11-29 10:30:51,0xebdb4156203c8b35b7a7c6f320786b98e5ac67c3,0x568aacee8c87f4c38d35431b12b0beab965ffb48,0,250:0x8e1bD5Da87C14dd8e08F7ecc2aBf9D1d558ea174:87,StableBattle,"StableBattle is a medieval real-time mass PvP tournament game based on S2P&E model.

S2P&E offers in-game rewards that are significant and sustainable as they come from DeFi yields resulting in players can't lose their initial funds. S2P&E can be implemented as a separate mechanics to existing games and NFT projects in addition to their own reward system. Think about it as multi chain DeFi protocol + tools/services for developers.",https://stablebattle.io/,,https://github.com/StableBattle,https://twitter.com/StableBattle," It's already backed by highly experienced crypto stakeholders from 7xvc.com, atka.io, brcapital.io and angels from mithraeum.io, azuro.org, opgames.org, metaguild.com.",17,Goerli Testnet,"New GameFi model + GameFi infrastructure for GameDevs, NFT collections, projects.",
0x37ad3db0b0bc56cea1909e6a6f21fd35453ef27f1d9a91e9edde75de10cc9cf8-0xebdb4156203c8b35b7a7c6f320786b98e5ac67c3,0x37ad3db0b0bc56cea1909e6a6f21fd35453ef27f1d9a91e9edde75de10cc9cf8,PENDING,2022-12-01 22:26:19,2022-12-01 22:26:19,0xebdb4156203c8b35b7a7c6f320786b98e5ac67c3,0xe126b3e5d052f1f575828f61feba4f4f2603652a,0,250:0x8e1bD5Da87C14dd8e08F7ecc2aBf9D1d558ea174:107,Revoke.cash - Helping you stay safe in web3,"Hey all, we're building free and open source tools to help you stay safe in web3! 👋

To use tokens in decentralised applications such as Uniswap you have to grant the application permission to spend tokens on your behalf - known as an allowance. Allowances are an important part of using these apps, but can be dangerous if left unchecked.

Bugs can exists and exploits can happen even in established projects, and by approving token allowances you are potentially exposing your wallet to these exploits. To keep yourself safe from allowance exploits it is a good practice to regularly inspect and revoke your allowances.

Revoke.cash comes in as a preventative tool to manage your token allowances and practice proper wallet hygiene. By regularly revoking active allowances you reduce the chances of becoming the victim of allowance exploits.

In many cases, phishing websites try to make you sign an allowance while they pretend to be an NFT mint or other legitimate use cases. When these phishing scams happen, it is recommended to use Revoke.cash to mitigate the damage, but it is even better to prevent the scam in the first place.

This is where the Revoke.cash Browser Extension comes in. The extension pops up whenever you are about to sign an allowance and will inform you of the allowance details. This can help you prevent signing malicious allowances.",https://revoke.cash,rkalis,RevokeCash,RevokeCash,Gitcoin Grants,1,"Yes, Revoke.cash supports 30+ chains, and the browser extension supports every EVM chain","As a DeFi ecosystem grows more funds will be at risk due to forgotten allowances, and more bad actors will be attracted to the ecosystem trying to scam newer users. Revoke.cash can help mitigate these issues.",
0x388fc68326283b17673aa3cf1286d2cd631083357680dce1badb2111a0380cb6-0xebdb4156203c8b35b7a7c6f320786b98e5ac67c3,0x388fc68326283b17673aa3cf1286d2cd631083357680dce1badb2111a0380cb6,PENDING,2022-12-04 18:12:27,2022-12-04 18:12:27,0xebdb4156203c8b35b7a7c6f320786b98e5ac67c3,0xf00fa744e27a6af21850d17c8bfb138bb55f337a,0,250:0x8e1bD5Da87C14dd8e08F7ecc2aBf9D1d558ea174:142,World of Magik,"Magik is a community led blockchain gaming protocol on the Fantom network.

In the 10 months since its founding by UK-based brothers Jimmy and Avery, a group of about a dozen game, smart contract and business developers have come together to build a better model for on-chain gaming. 

Our goal is to build an inclusive decentralized gaming “world” where user participation drives the direction of development and culture. 

We’re using Fantom rails to facilitate near-instant in-game transaction settlement for arena matches, self-custodied user inventories and “faction” armories. 

We’re designing a new v2 tokenomic model and smart contract system - replacing token inflation with platform fees as the driver of in-game incentives’ and healthy ecosystem participation. 

We’re focused on providing the maximum value to users, and building the most kickass gaming community on the blockchain - or anywhere else.

We had a pretty unusual route to “finding ourselves” as a protocol. Last March, we launched a yield optimizer platform called Magik.Farm, intent on generating fees to keep the lights on while the market tanked. 

Our lead game developer Kyle started off as a community member. So did our operations manager Brett. In fact, every member of the Magik team has come from its community (myself included). 

We’ve spent close to $0 on marketing or advertising. We’ve never raised funds/vc or dumped tokens for project runway. We’ve been a net accumulator of MAGIK.

We’re proud of what we’ve done together over the past 10 months - building a team of deep conviction from 0. We humbly ask for your support in helping us take it to the next level.

Magik Owen
",https://worldofmagik.com,Magikfinance,,magikthedog,No,8,No,"We’ve structured an early go-to market approach with Magik Arena (beta) that’s focused on on-boarding users from BSC and AVAX via “Faction” NFT mints.   Our role at Magik.Farm as a service provider allowed us to build deep relationships with numerous protocols on other chains. They’re pitching in to promote and facilitate an in-game starter pack that will get its users a bit of MAGIK and FTM gas. We want to make it easy for anyone to jump in and play.  We’re looking to build multi-layered and meaningful in-game economies within a UX that just works. We want users to ultimately drive and be the beneficiaries of those economies. Our focus is primarily on game development, but long term we see potential for Magik World as a space for social hangouts, subscription based communities and 3rd party vendor storefronts for in-game and out of game assets.  There’s a vast world waiting to be built. We’re making it easy to become a homesteader and cultivate the land.",
0x3c99bc98e0c72d11db724e69a878b4b64c42bf7de26da11ca11e3df3a909b443-0xebdb4156203c8b35b7a7c6f320786b98e5ac67c3,0x3c99bc98e0c72d11db724e69a878b4b64c42bf7de26da11ca11e3df3a909b443,PENDING,2022-12-03 15:11:37,2022-12-03 15:11:37,0xebdb4156203c8b35b7a7c6f320786b98e5ac67c3,0x9a8568782896c4d4153b8b4d7e440e84e2c2cfbb,0,250:0x8e1bD5Da87C14dd8e08F7ecc2aBf9D1d558ea174:128,Debets Protocol,A fully Decentralized & Permissionless Web3 iGaming Platform.,https://app.debets.org,,,https://twitter.com/debets_org,No,4 members,"yes, polygon",Debets can provide a decentralized gambling platform for all tokens in FTM network. It will be an innovative use case for token holders.,
